{
  "intent_kind": "arc-flash",
  "version": "1.0.0",
  "produced_by_skill_version": "arc-flash/1.0.0",
  "tool_call_pending": true,
  "nodes": [
    {
      "node_id": "SERVICE-480V",
      "parent_node_id": null,
      "designation": "Main service entrance 480V 1200A",
      "equipment_type": "metal-clad switchgear",
      "current_type": "ac",
      "voltage_v": 480,
      "incident_energy_cal_per_cm2": 12.0,
      "arc_flash_boundary_mm": 1800,
      "working_distance_mm": 455,
      "limited_approach_movable_mm": 3050,
      "limited_approach_fixed_mm": 1070,
      "restricted_approach_mm": 305,
      "ppe_category": 3,
      "method_applied": "lee_1982",
      "label_recommended": true,
      "label_required_per": "NFPA 70E:2024 §130.5(H)",
      "produced_at": "2026-05-17"
    },
    {
      "node_id": "SERVICE-480V.PV-INV-1",
      "parent_node_id": "SERVICE-480V",
      "designation": "PV inverter 100 kW AC output 480V",
      "equipment_type": "inverter output breaker",
      "current_type": "ac",
      "voltage_v": 480,
      "incident_energy_cal_per_cm2": 7.0,
      "arc_flash_boundary_mm": 1100,
      "working_distance_mm": 455,
      "limited_approach_movable_mm": 3050,
      "limited_approach_fixed_mm": 1070,
      "restricted_approach_mm": 305,
      "ppe_category": 2,
      "method_applied": "lee_1982",
      "label_recommended": true,
      "label_required_per": "NFPA 70E:2024 §130.5(H)",
      "produced_at": "2026-05-17"
    },
    {
      "node_id": "PV-INV-1.DC-STR-1",
      "parent_node_id": "SERVICE-480V.PV-INV-1",
      "designation": "PV combiner 600V DC input (8-string 12.5 kWp)",
      "equipment_type": "PV combiner box",
      "current_type": "dc",
      "voltage_v": 600,
      "incident_energy_cal_per_cm2": 2.0,
      "arc_flash_boundary_mm": 450,
      "working_distance_mm": 305,
      "limited_approach_movable_mm": 3050,
      "limited_approach_fixed_mm": 1070,
      "restricted_approach_mm": 305,
      "ppe_category": 1,
      "method_applied": "dc_doan",
      "label_recommended": false,
      "label_required_per": "NFPA 70E:2024 §130.5(H) — DC optional (low IE)",
      "produced_at": "2026-05-17"
    },
    {
      "node_id": "SERVICE-480V.DCFC-1",
      "parent_node_id": "SERVICE-480V",
      "designation": "DC fast charger AC input 50 kW",
      "equipment_type": "DCFC AC input breaker",
      "current_type": "ac",
      "voltage_v": 480,
      "incident_energy_cal_per_cm2": 8.0,
      "arc_flash_boundary_mm": 1250,
      "working_distance_mm": 455,
      "limited_approach_movable_mm": 3050,
      "limited_approach_fixed_mm": 1070,
      "restricted_approach_mm": 305,
      "ppe_category": 3,
      "method_applied": "lee_1982",
      "label_recommended": true,
      "label_required_per": "NFPA 70E:2024 §130.5(H)",
      "produced_at": "2026-05-17"
    },
    {
      "node_id": "DCFC-1.DC-OUT",
      "parent_node_id": "SERVICE-480V.DCFC-1",
      "designation": "DCFC output 500V DC to vehicle connector",
      "equipment_type": "DC fast charger output",
      "current_type": "dc",
      "voltage_v": 500,
      "incident_energy_cal_per_cm2": 6.0,
      "arc_flash_boundary_mm": 850,
      "working_distance_mm": 300,
      "limited_approach_movable_mm": 3050,
      "limited_approach_fixed_mm": 1070,
      "restricted_approach_mm": 305,
      "ppe_category": 2,
      "method_applied": "dc_doan",
      "label_recommended": true,
      "label_required_per": "NFPA 70E:2024 §130.5(H)",
      "produced_at": "2026-05-17"
    }
  ]
}
